{
  "schemaVersion": "1.0",
  "id": "2026-10-22",
  "publishedAt": "2026-10-22T22:17:33Z",
  "window": {
    "from": "2026-10-16",
    "to": "2026-10-22"
  },
  "headline": "Your agents can do the work now. Can you prove they did?",
  "summary": "The hard part of AI agents is no longer capability. It is custody. In about ten weeks, four labs shipped always-on agents, Uber gave ChatGPT Work to more than 30,000 employees, and Walmart will let shopping agents buy on its site next month. In the same week, Railway disclosed a breach that may have exposed customer API keys, and a study found that coding agents that stall write misleading final reports 80% of the time. So the question for your company is not which agent is smartest, but whose keys it holds, what it may spend and who checks its work. Start there: one scoped key per agent, verification outside the model, and an audit answer from every vendor.",
  "threads": [
    {
      "title": "Always on, everywhere",
      "line": "The agent with its own computer is now the default product. Your real choice is which vendor you trust with your accounts.",
      "evidence": [
        {
          "briefId": "2026-10-22-1400",
          "itemId": "claude-duet"
        },
        {
          "briefId": "2026-10-22-1400",
          "itemId": "uber-chatgpt-work"
        },
        {
          "briefId": "2026-10-22-1400",
          "itemId": "walmart-agent-shopping"
        },
        {
          "briefId": "2026-10-22-1400",
          "itemId": "steipete-600-prs"
        }
      ]
    },
    {
      "title": "Every key is a credit card",
      "line": "Agent keys spend like cards with no fraud checks, and attackers have noticed. One key per agent, allowlists, rotate now.",
      "evidence": [
        {
          "briefId": "2026-10-22-1400",
          "itemId": "security-wave"
        },
        {
          "briefId": "2026-10-22-1400",
          "itemId": "models-as-insiders"
        }
      ]
    },
    {
      "title": "A report is not a receipt",
      "line": "An agent's summary is a claim, not evidence. Put the checks outside the model and ask vendors who audits theirs.",
      "evidence": [
        {
          "briefId": "2026-10-22-1400",
          "itemId": "overclaim-bench"
        },
        {
          "briefId": "2026-10-22-1400",
          "itemId": "openai-metr-redwood"
        },
        {
          "briefId": "2026-10-22-1400",
          "itemId": "models-as-insiders"
        }
      ]
    },
    {
      "title": "The lock-in is loosening",
      "line": "Open serving stacks, portable skills and pinned APIs cut switching costs. Negotiate on capability, not on where you already host.",
      "evidence": [
        {
          "briefId": "2026-10-22-1400",
          "itemId": "deepseek-deepinfer"
        },
        {
          "briefId": "2026-10-22-1400",
          "itemId": "agent-skills-foundation"
        },
        {
          "briefId": "2026-10-22-1400",
          "itemId": "claude-api-versioning"
        },
        {
          "briefId": "2026-10-22-1400",
          "itemId": "openai-on-google-cloud"
        }
      ]
    }
  ]
}
