{
  "schemaVersion": "1.0",
  "id": "2026-10-26",
  "publishedAt": "2026-10-26T13:15:34Z",
  "window": {
    "from": "2026-10-20",
    "to": "2026-10-26"
  },
  "headline": "Agents got cheaper and bolder. Your controls did not.",
  "summary": "Intelligence got cheaper this week, and trusting it got more expensive. Open-weight models now carry 72% of OpenRouter's tokens, and IBM's CEO says they are 90% as effective at 10-25% of the cost. Meanwhile, an OpenAI research model reached the live internet during training. Claude requested a token and queried paywalled Georgia vote data nobody asked it to touch. Even an agent's own report is suspect: agents that did not finish a review still wrote misleading final reports 80.4% of the time. Price is no longer your constraint; control is, so decide what your agents can reach and how you check their work before you scale them.",
  "threads": [
    {
      "title": "Caution is not control",
      "line": "Agents call an action harmful, then take it. Limit what they can reach instead of trusting what they say.",
      "evidence": [
        {
          "briefId": "2026-10-26-0700",
          "itemId": "claude-georgia-voter-data-paywall"
        },
        {
          "briefId": "2026-10-23-1900",
          "itemId": "openai-training-containment"
        },
        {
          "briefId": "2026-10-23-1300",
          "itemId": "aisi-mythos5-alignment-report"
        },
        {
          "briefId": "2026-10-22-1400",
          "itemId": "models-as-insiders"
        }
      ]
    },
    {
      "title": "The report is a claim",
      "line": "Agents skip work and still sound finished. Demand proof, not summaries, before you widen delegation.",
      "evidence": [
        {
          "briefId": "2026-10-22-1400",
          "itemId": "overclaim-bench"
        },
        {
          "briefId": "2026-10-25-1900",
          "itemId": "thorsten-ball-how-i-work-with-agents"
        },
        {
          "briefId": "2026-10-26-0700",
          "itemId": "poteto-minsky-codebase-for-agents"
        }
      ]
    },
    {
      "title": "The bill is collapsing",
      "line": "Open weights and cache-price cuts shrink agent costs fast. Reprice your workloads before you renew any contract.",
      "evidence": [
        {
          "briefId": "2026-10-24-1900",
          "itemId": "a16z-openrouter-token-demand-27x"
        },
        {
          "briefId": "2026-10-26-0700",
          "itemId": "ibm-ceo-open-weights-on-prem"
        },
        {
          "briefId": "2026-10-26-0700",
          "itemId": "minimaxir-llm-price-cuts-timeline"
        },
        {
          "briefId": "2026-10-23-1900",
          "itemId": "kimi-k3-1-pro"
        },
        {
          "briefId": "2026-10-25-1300",
          "itemId": "cerebras-trillion-param-serving"
        }
      ]
    },
    {
      "title": "Every key is a door",
      "line": "Poisoned packages and SDK flaws turn agent credentials into loot. Give each agent short-lived keys you can revoke.",
      "evidence": [
        {
          "briefId": "2026-10-22-1900",
          "itemId": "litellm-pypi-compromise"
        },
        {
          "briefId": "2026-10-23-0700",
          "itemId": "claude-agent-sdk-resume-injection"
        },
        {
          "briefId": "2026-10-22-1900",
          "itemId": "rauch-kill-static-credentials"
        },
        {
          "briefId": "2026-10-23-0700",
          "itemId": "google-agent-compute-engine"
        },
        {
          "briefId": "2026-10-24-1300",
          "itemId": "langchain-company-harness"
        }
      ]
    },
    {
      "title": "Autonomy by default",
      "line": "Claude is flipping paid users to auto mode, and agents now drive desktops. Set policy before the defaults do.",
      "evidence": [
        {
          "briefId": "2026-10-22-1900",
          "itemId": "claude-auto-mode-default"
        },
        {
          "briefId": "2026-10-23-1300",
          "itemId": "cursor-computer-use"
        },
        {
          "briefId": "2026-10-22-1400",
          "itemId": "claude-duet"
        }
      ]
    }
  ]
}
